{
  "baseline": {
    "decoder_started": true,
    "output": {
      "bytes": 12288,
      "path": "a7-run/baseline.output",
      "sha256": "ccb56bbb8c5bab28393647cc701f2fa1bfab006c0abc5ae243ae1c079bbe27b1"
    },
    "returncode": 0,
    "sidecars": [],
    "signal": null,
    "stderr": {
      "bytes": 0,
      "path": "a7-run/baseline.stderr",
      "sha256": "e3b0c44298fc1c149afbf4c8996fb92427ae41e4649b934ca495991b7852b855"
    },
    "timed_out": false,
    "validation": "disabled",
    "worker_archive": {
      "bytes": 245,
      "path": "a7-run/baseline.archive",
      "sha256": "914bbe59440ab51e4240214cb6254a3c23aeff4bc85b1986750bcd5166b54c2d"
    }
  },
  "corrupt": {
    "bytes": 20693,
    "path": "a7-corrupt/corrupt.json",
    "sha256": "a82ac37ba8748f388328062f7848d8119e87260c3710757e7aa54ed1661a8a4a"
  },
  "counts": {
    "off": {
      "crash": 0,
      "detected": 0,
      "hang": 0,
      "harmless": 0,
      "refusal": 100,
      "silent_error": 0
    },
    "on": {
      "crash": 0,
      "detected": 100,
      "hang": 0,
      "harmless": 0,
      "refusal": 0,
      "silent_error": 0
    }
  },
  "evidence_kind": "synthetic",
  "integrity": {
    "off": "PASS",
    "on": "PASS"
  },
  "prepared": {
    "bytes": 40897,
    "path": "a7-prepared/prepared.json",
    "sha256": "7432abac4601e9880be50c91b3efc32416e6b7580a4be9f2d6db652ead5b10a9"
  },
  "rows": [
    {
      "archive": {
        "bytes": 245,
        "path": "a7-corrupt/000.archive",
        "sha256": "92f1950cf806b1be9e165c1f43390860248397aa28a9aa86af5abd465df940ad"
      },
      "classification": "detected",
      "hash_enabled": true,
      "id": 0,
      "raw": {
        "decoder_started": false,
        "returncode": null,
        "signal": null,
        "timed_out": false,
        "validation": "original_sha_mismatch"
      }
    },
    {
      "archive": {
        "bytes": 245,
        "path": "a7-corrupt/000.archive",
        "sha256": "92f1950cf806b1be9e165c1f43390860248397aa28a9aa86af5abd465df940ad"
      },
      "classification": "refusal",
      "hash_enabled": false,
      "id": 0,
      "raw": {
        "decoder_started": true,
        "output": {
          "bytes": 0,
          "path": "a7-run/000-off.output",
          "sha256": "e3b0c44298fc1c149afbf4c8996fb92427ae41e4649b934ca495991b7852b855"
        },
        "returncode": 1,
        "sidecars": [],
        "signal": null,
        "stderr": {
          "bytes": 862,
          "path": "a7-run/000-off.stderr",
          "sha256": "27bc26b7656aca171c3fec52d267d6be13d8b797e066a73955337964cbea0fb5"
        },
        "timed_out": false,
        "validation": "disabled",
        "worker_archive": {
          "bytes": 245,
          "path": "a7-run/000-off.archive",
          "sha256": "92f1950cf806b1be9e165c1f43390860248397aa28a9aa86af5abd465df940ad"
        }
      }
    },
    {
      "archive": {
        "bytes": 245,
        "path": "a7-corrupt/001.archive",
        "sha256": "6cb6395b2b30befc802dbbdb9324eef23e337644077b8cb0383a4b34b671d2c7"
      },
      "classification": "detected",
      "hash_enabled": true,
      "id": 1,
      "raw": {
        "decoder_started": false,
        "returncode": null,
        "signal": null,
        "timed_out": false,
        "validation": "original_sha_mismatch"
      }
    },
    {
      "archive": {
        "bytes": 245,
        "path": "a7-corrupt/001.archive",
        "sha256": "6cb6395b2b30befc802dbbdb9324eef23e337644077b8cb0383a4b34b671d2c7"
      },
      "classification": "refusal",
      "hash_enabled": false,
      "id": 1,
      "raw": {
        "decoder_started": true,
        "output": {
          "bytes": 0,
          "path": "a7-run/001-off.output",
          "sha256": "e3b0c44298fc1c149afbf4c8996fb92427ae41e4649b934ca495991b7852b855"
        },
        "returncode": 1,
        "sidecars": [],
        "signal": null,
        "stderr": {
          "bytes": 862,
          "path": "a7-run/001-off.stderr",
          "sha256": "27bc26b7656aca171c3fec52d267d6be13d8b797e066a73955337964cbea0fb5"
        },
        "timed_out": false,
        "validation": "disabled",
        "worker_archive": {
          "bytes": 245,
          "path": "a7-run/001-off.archive",
          "sha256": "6cb6395b2b30befc802dbbdb9324eef23e337644077b8cb0383a4b34b671d2c7"
        }
      }
    },
    {
      "archive": {
        "bytes": 245,
        "path": "a7-corrupt/002.archive",
        "sha256": "ae26a4dfb4c5b8ef1d1be2e634c4ae1defe772ccd581f68c68f05c697c19f242"
      },
      "classification": "detected",
      "hash_enabled": true,
      "id": 2,
      "raw": {
        "decoder_started": false,
        "returncode": null,
        "signal": null,
        "timed_out": false,
        "validation": "original_sha_mismatch"
      }
    },
    {
      "archive": {
        "bytes": 245,
        "path": "a7-corrupt/002.archive",
        "sha256": "ae26a4dfb4c5b8ef1d1be2e634c4ae1defe772ccd581f68c68f05c697c19f242"
      },
      "classification": "refusal",
      "hash_enabled": false,
      "id": 2,
      "raw": {
        "decoder_started": true,
        "output": {
          "bytes": 0,
          "path": "a7-run/002-off.output",
          "sha256": "e3b0c44298fc1c149afbf4c8996fb92427ae41e4649b934ca495991b7852b855"
        },
        "returncode": 1,
        "sidecars": [],
        "signal": null,
        "stderr": {
          "bytes": 862,
          "path": "a7-run/002-off.stderr",
          "sha256": "27bc26b7656aca171c3fec52d267d6be13d8b797e066a73955337964cbea0fb5"
        },
        "timed_out": false,
        "validation": "disabled",
        "worker_archive": {
          "bytes": 245,
          "path": "a7-run/002-off.archive",
          "sha256": "ae26a4dfb4c5b8ef1d1be2e634c4ae1defe772ccd581f68c68f05c697c19f242"
        }
      }
    },
    {
      "archive": {
        "bytes": 245,
        "path": "a7-corrupt/003.archive",
        "sha256": "e954984cd4939fc5974bc669dc3da2dc011d1cebc9b0f5b392a67a148f2bfe3b"
      },
      "classification": "detected",
      "hash_enabled": true,
      "id": 3,
      "raw": {
        "decoder_started": false,
        "returncode": null,
        "signal": null,
        "timed_out": false,
        "validation": "original_sha_mismatch"
      }
    },
    {
      "archive": {
        "bytes": 245,
        "path": "a7-corrupt/003.archive",
        "sha256": "e954984cd4939fc5974bc669dc3da2dc011d1cebc9b0f5b392a67a148f2bfe3b"
      },
      "classification": "refusal",
      "hash_enabled": false,
      "id": 3,
      "raw": {
        "decoder_started": true,
        "output": {
          "bytes": 0,
          "path": "a7-run/003-off.output",
          "sha256": "e3b0c44298fc1c149afbf4c8996fb92427ae41e4649b934ca495991b7852b855"
        },
        "returncode": 1,
        "sidecars": [],
        "signal": null,
        "stderr": {
          "bytes": 862,
          "path": "a7-run/003-off.stderr",
          "sha256": "27bc26b7656aca171c3fec52d267d6be13d8b797e066a73955337964cbea0fb5"
        },
        "timed_out": false,
        "validation": "disabled",
        "worker_archive": {
          "bytes": 245,
          "path": "a7-run/003-off.archive",
          "sha256": "e954984cd4939fc5974bc669dc3da2dc011d1cebc9b0f5b392a67a148f2bfe3b"
        }
      }
    },
    {
      "archive": {
        "bytes": 245,
        "path": "a7-corrupt/004.archive",
        "sha256": "e19c065980f2941f7f7145d719c5c4a9bcdae54135b87265d4c9ba9a17ea709b"
      },
      "classification": "detected",
      "hash_enabled": true,
      "id": 4,
      "raw": {
        "decoder_started": false,
        "returncode": null,
        "signal": null,
        "timed_out": false,
        "validation": "original_sha_mismatch"
      }
    },
    {
      "archive": {
        "bytes": 245,
        "path": "a7-corrupt/004.archive",
        "sha256": "e19c065980f2941f7f7145d719c5c4a9bcdae54135b87265d4c9ba9a17ea709b"
      },
      "classification": "refusal",
      "hash_enabled": false,
      "id": 4,
      "raw": {
        "decoder_started": true,
        "output": {
          "bytes": 0,
          "path": "a7-run/004-off.output",
          "sha256": "e3b0c44298fc1c149afbf4c8996fb92427ae41e4649b934ca495991b7852b855"
        },
        "returncode": 1,
        "sidecars": [],
        "signal": null,
        "stderr": {
          "bytes": 862,
          "path": "a7-run/004-off.stderr",
          "sha256": "27bc26b7656aca171c3fec52d267d6be13d8b797e066a73955337964cbea0fb5"
        },
        "timed_out": false,
        "validation": "disabled",
        "worker_archive": {
          "bytes": 245,
          "path": "a7-run/004-off.archive",
          "sha256": "e19c065980f2941f7f7145d719c5c4a9bcdae54135b87265d4c9ba9a17ea709b"
        }
      }
    },
    {
      "archive": {
        "bytes": 245,
        "path": "a7-corrupt/005.archive",
        "sha256": "3a2547e41c92d61683f1975c7a7deb48f343d46a1ce1837eeda701038a790ef9"
      },
      "classification": "detected",
      "hash_enabled": true,
      "id": 5,
      "raw": {
        "decoder_started": false,
        "returncode": null,
        "signal": null,
        "timed_out": false,
        "validation": "original_sha_mismatch"
      }
    },
    {
      "archive": {
        "bytes": 245,
        "path": "a7-corrupt/005.archive",
        "sha256": "3a2547e41c92d61683f1975c7a7deb48f343d46a1ce1837eeda701038a790ef9"
      },
      "classification": "refusal",
      "hash_enabled": false,
      "id": 5,
      "raw": {
        "decoder_started": true,
        "output": {
          "bytes": 0,
          "path": "a7-run/005-off.output",
          "sha256": "e3b0c44298fc1c149afbf4c8996fb92427ae41e4649b934ca495991b7852b855"
        },
        "returncode": 1,
        "sidecars": [],
        "signal": null,
        "stderr": {
          "bytes": 862,
          "path": "a7-run/005-off.stderr",
          "sha256": "27bc26b7656aca171c3fec52d267d6be13d8b797e066a73955337964cbea0fb5"
        },
        "timed_out": false,